{
  "$schema": "https://json-schema.org/draft/2020-12/schema",
  "title": "VoiceLog critical path coverage matrix",
  "type": "object",
  "required": ["version", "areas"],
  "properties": {
    "version": { "type": "integer", "minimum": 1 },
    "description": { "type": "string" },
    "minimumDimensionsPerArea": { "type": "integer", "minimum": 1 },
    "areas": {
      "type": "array",
      "minItems": 1,
      "items": {
        "type": "object",
        "required": ["id", "priority", "owner", "dimensions", "requiredTests"],
        "properties": {
          "id": { "type": "string", "minLength": 1 },
          "priority": { "type": "string", "enum": ["P0", "P1", "P2", "P3"] },
          "owner": { "type": "string", "minLength": 1 },
          "description": { "type": "string" },
          "dimensions": {
            "type": "array",
            "minItems": 1,
            "items": { "type": "string", "minLength": 1 }
          },
          "requiredTests": {
            "type": "array",
            "minItems": 1,
            "items": { "type": "string", "minLength": 1 }
          }
        },
        "additionalProperties": false
      }
    }
  },
  "additionalProperties": true
}
